{
  "schemaVersion": 1,
  "cardId": "spell_draw_st_001",
  "name": "トリガー・ドロー",
  "types": [
    "Spell"
  ],
  "cost": 2,
  "civilizations": [
    "Water"
  ],
  "effects": [
    {
      "kind": "triggered",
      "id": "st",
      "text": "シールド・トリガー",
      "condition": {
        "when": "OnBreakShield",
        "if": [
          {
            "type": "IsThisRevealedFromShield",
            "value": true
          }
        ]
      },
      "effect": [
        {
          "op": "Cast",
          "who": "you",
          "selector": {
            "who": "source"
          }
        }
      ],
      "flags": [
        "ShieldTrigger"
      ]
    },
    {
      "kind": "triggered",
      "id": "cast",
      "text": "呪文解決：1ドロー",
      "condition": {
        "when": "OnSpellCast",
        "if": [
          {
            "type": "SourceIs",
            "value": "this"
          }
        ]
      },
      "effect": [
        {
          "op": "Draw",
          "who": "you",
          "n": 1
        }
      ]
    }
  ]
}