{
  "schemaVersion": 1,
  "cardId": "creature_sa_002",
  "name": "突撃ドラゴノイド",
  "types": [
    "Creature"
  ],
  "cost": 3,
  "civilizations": [
    "Fire"
  ],
  "power": 2000,
  "race": [
    "Dragonoid"
  ],
  "effects": [
    {
      "kind": "triggered",
      "id": "atk_boost",
      "text": "+2000（ターン終了）",
      "condition": {
        "when": "OnAttack",
        "if": [
          {
            "type": "SourceIs",
            "value": "this"
          }
        ]
      },
      "effect": [
        {
          "op": "PowerMod",
          "selector": {
            "who": "source"
          },
          "delta": 2000,
          "duration": "UntilEndOfTurn"
        }
      ],
      "layer": "Power"
    }
  ]
}