{
  "schemaVersion": 1,
  "cardId": "guard_beast_003",
  "name": "守護獣",
  "types": [
    "Creature"
  ],
  "cost": 4,
  "civilizations": [
    "Light"
  ],
  "power": 3000,
  "effects": [
    {
      "kind": "replacement",
      "id": "self_save",
      "text": "破壊されるなら、代わりにタップされる",
      "replacement": [
        {
          "replace": "WouldBeDestroyed",
          "by": [
            {
              "op": "Tap",
              "selector": {
                "who": "source"
              }
            }
          ]
        }
      ],
      "priority": 0
    }
  ]
}